{
  "@context": [
    "https://www.w3.org/2018/credentials/v1",
    "https://nfh-trust-labs.github.io/vc-schemas/energy-credentials/consumer-profile-vc/context.jsonld"
  ],
  "id": "urn:uuid:3a5b8c9d-1234-5678-abcd-ef9012345678",
  "type": ["VerifiableCredential", "UtilityConsumerCredential"],
  "issuer": {
    "id": "did:web:example-utility.com",
    "name": "Example Energy Utility",
    "licenseNumber": "REG-2025-00001"
  },
  "issuanceDate": "2025-01-13T10:30:00Z",
  "credentialSubject": {
    "id": "did:example:consumer:abc123",
    "consumerNumber": "UTIL-2025-001234567",
    "fullName": "Jane Doe",
    "installationAddress": {
      "fullAddress": "123 Energy Street, Unit 4",
      "city": "Metro City",
      "district": "Metro District",
      "stateProvince": "Example State",
      "postalCode": "12345",
      "country": "US"
    },
    "premisesType": "Residential",
    "connectionType": "Single-phase",
    "sanctionedLoadKW": 5,
    "tariffCategoryCode": "RES-01",
    "meterNumber": "MET2025789456123",
    "serviceConnectionDate": "2025-01-10",
    "derSolar": {
      "capacityKWp": 3,
      "commissioningDate": "2025-01-12"
    },
    "derBattery": {
      "storageCapacityKWh": 10,
      "powerRatingKW": 5,
      "commissioningDate": "2025-01-12"
    }
  },
  "proof": {
    "type": "Ed25519Signature2020",
    "created": "2025-01-13T10:30:00Z",
    "verificationMethod": "did:web:example-utility.com#key-1",
    "proofPurpose": "assertionMethod",
    "proofValue": "z58DAdFfa9SkqZMVPxAQpic7ndTaXoT..."
  }
}
